[
  {
    "id": "opp-nasa-space-apps-nyc",
    "title": "NASA Space Apps Challenge NYC (hackathon)",
    "provider": "NASA Space Apps Challenge, local event hosted at NYU Tandon CUSP",
    "url": "https://www.spaceappschallenge.org/2026/local-events/new-york/",
    "source_url": "https://www.spaceappschallenge.org/2026/local-events/new-york/",
    "summary": "A free weekend hackathon in Downtown Brooklyn where teams build solutions to NASA's 2026 challenges. Open to all ages; no science background needed. Under-18s come with a parent or guardian.",
    "school_levels": [
      "HS",
      "college"
    ],
    "eligibility": {
      "class_years": [],
      "min_gpa": null,
      "max_age": null,
      "citizenship": [],
      "majors": [],
      "identity_groups": [],
      "need_based": false,
      "nyc_only": false,
      "geo_scope": "national",
      "geo_areas": [
        "NYC"
      ],
      "enrolled_at": [],
      "prerequisites": []
    },
    "focus_tags": [
      "hackathon",
      "coding",
      "space",
      "nasa",
      "data-science",
      "team"
    ],
    "evidence": [
      {
        "field": "dates",
        "quote": "NASA's Space Apps Challenge NYC NOV 13 - 15 Brooklyn, New York, US In-Person",
        "page": "https://www.mlh.com/seasons/2027/events"
      },
      {
        "field": "location",
        "quote": "370 Jay St, Brooklyn, NY 11201",
        "page": "https://luma.com/1dmo9dwu"
      },
      {
        "field": "cost",
        "quote": "There is no cost to participate in the NASA Space Apps Challenge.",
        "page": "https://www.spaceappschallenge.org/resources/participant-faqs/"
      },
      {
        "field": "eligibility",
        "quote": "The NASA Space Apps Challenge is open to all ages!",
        "page": "https://www.spaceappschallenge.org/resources/participant-faqs/"
      },
      {
        "field": "eligibility",
        "quote": "If under the age of 18, participants must be registered for the event by a parent or legal guardian and must be accompanied by a parent or legal guardian at all times during the event.",
        "page": "https://www.spaceappschallenge.org/resources/participant-faqs/"
      }
    ],
    "trust": {
      "badge": "web_verified",
      "checked_at": "2026-10-23",
      "note": "The official local-event page loads with JavaScript, so dates and venue came from the organizer's Luma page (and MLH for cross-checking). Re-check the venue floor before the demo."
    },
    "is_sample": false,
    "extracted_at": "2026-10-23",
    "type": "hackathon",
    "start_date": "2026-11-13",
    "end_date": "2026-11-15",
    "application_deadline": null,
    "location": {
      "venue": "CUSP, NYU Tandon School of Engineering",
      "borough": "Brooklyn",
      "address": "370 Jay St, Brooklyn, NY 11201"
    },
    "is_online": false,
    "cost": 0,
    "covers": [],
    "stipend_amount": null,
    "apply_effort": [
      "short_form"
    ],
    "capacity": null,
    "unlocks": [
      {
        "scholarship_id": "smp-sch-gowanus-hackathon-builder",
        "reason": "Finishing a Space Apps project counts as the completed hackathon this award requires."
      }
    ]
  },
  {
    "id": "opp-regeneron-sts",
    "title": "Regeneron Science Talent Search 2027",
    "provider": "Society for Science",
    "url": "https://www.societyforscience.org/regeneron-sts/",
    "source_url": "https://www.societyforscience.org/regeneron-sts/frequently-asked-questions/",
    "summary": "The top U.S. research competition for high school seniors. Submit an independent research project online. 300 scholars win $2,000 (plus $2,000 for their school); the top award is $250,000.",
    "school_levels": [
      "HS"
    ],
    "eligibility": {
      "class_years": [
        "hs_12"
      ],
      "min_gpa": null,
      "max_age": null,
      "citizenship": [],
      "majors": [],
      "identity_groups": [],
      "need_based": false,
      "nyc_only": false,
      "geo_scope": "national",
      "geo_areas": [
        "US"
      ],
      "enrolled_at": [],
      "prerequisites": []
    },
    "focus_tags": [
      "research",
      "science",
      "stem",
      "competition"
    ],
    "evidence": [
      {
        "field": "deadline",
        "quote": "from June 1 to November 5, 2026"
      },
      {
        "field": "deadline",
        "quote": "on November 5 at 8PM ET, no exceptions"
      },
      {
        "field": "eligibility",
        "quote": "Any student who is living in and attending their last year of secondary school in the US and its territories may apply"
      },
      {
        "field": "eligibility",
        "quote": "regardless of citizenship"
      },
      {
        "field": "prizes",
        "quote": "Three hundred scholars are awarded $2,000"
      },
      {
        "field": "prizes",
        "quote": "The top award is $250,000."
      }
    ],
    "trust": {
      "badge": "web_verified",
      "checked_at": "2026-10-23",
      "note": "Online application. The FAQ mentions no entry fee; confirm during spot-check."
    },
    "is_sample": false,
    "extracted_at": "2026-10-23",
    "type": "competition",
    "start_date": null,
    "end_date": null,
    "application_deadline": "2026-11-05",
    "location": null,
    "is_online": true,
    "cost": 0,
    "covers": [],
    "stipend_amount": null,
    "apply_effort": [
      "essay",
      "rec",
      "transcript",
      "project"
    ],
    "capacity": null,
    "unlocks": []
  },
  {
    "id": "opp-msk-summer-student-program",
    "title": "MSK Summer Student Program (HOPP) 2027",
    "provider": "Memorial Sloan Kettering Cancer Center",
    "url": "https://www.mskcc.org/education-training/high-school-college/hopp-summer-student",
    "source_url": "https://www.mskcc.org/education-training/high-school-college/hopp-summer-student",
    "summary": "Eight paid weeks doing cancer research in an MSK lab on the Upper East Side, with a $1,200 stipend. For high school juniors with strong science grades who live within 25 miles. Applications open December 1, 2026.",
    "school_levels": [
      "HS"
    ],
    "eligibility": {
      "class_years": [
        "hs_11"
      ],
      "min_gpa": 3.5,
      "max_age": null,
      "citizenship": [],
      "majors": [],
      "identity_groups": [],
      "need_based": false,
      "nyc_only": false,
      "geo_scope": "region",
      "geo_areas": [
        "NY/NJ/CT within 25 miles of MSK"
      ],
      "enrolled_at": [],
      "prerequisites": []
    },
    "focus_tags": [
      "research",
      "biology",
      "medicine",
      "cancer",
      "paid",
      "summer"
    ],
    "evidence": [
      {
        "field": "deadline",
        "quote": "Applications for 2027 Summer Student Program will open on December 1, 2026."
      },
      {
        "field": "deadline",
        "quote": "All application materials must be submitted by 8:00 a.m. EST on February 5, 2027."
      },
      {
        "field": "dates",
        "quote": "The 8-week program begins on June 29 and ends August 20, 2027."
      },
      {
        "field": "eligibility",
        "quote": "Currently enrolled as a high school junior"
      },
      {
        "field": "eligibility",
        "quote": "Must be 16 or older by June 2027"
      },
      {
        "field": "eligibility",
        "quote": "A 3.5 grade point average in science subjects"
      },
      {
        "field": "cost",
        "quote": "Students receive a stipend of $1,200 for the summer."
      }
    ],
    "trust": {
      "badge": "web_verified",
      "checked_at": "2026-10-23",
      "note": "min_gpa is the science-subject GPA, not overall. No housing or transportation provided."
    },
    "is_sample": false,
    "extracted_at": "2026-10-23",
    "type": "program",
    "start_date": "2027-06-29",
    "end_date": "2027-08-20",
    "application_deadline": "2027-02-05",
    "location": {
      "venue": "Memorial Sloan Kettering Cancer Center, Main Campus",
      "borough": "Manhattan",
      "address": "Upper East Side, Manhattan"
    },
    "is_online": false,
    "cost": 0,
    "covers": [
      "stipend"
    ],
    "stipend_amount": 1200,
    "apply_effort": [
      "essay",
      "rec",
      "transcript"
    ],
    "capacity": null,
    "unlocks": []
  },
  {
    "id": "opp-cooper-union-saturday-program",
    "title": "Cooper Union Saturday Program (free art & architecture classes), Spring 2027",
    "provider": "The Cooper Union",
    "url": "https://cooper.edu/academics/outreach-and-pre-college/saturday-program",
    "source_url": "https://cooper.edu/academics/outreach-and-pre-college/saturday-program",
    "summary": "Free Saturday visual art and architecture classes for NYC public and charter high school students, especially those whose schools lack a full art program. No experience needed.",
    "school_levels": [
      "HS"
    ],
    "eligibility": {
      "class_years": [
        "hs_9",
        "hs_10",
        "hs_11",
        "hs_12"
      ],
      "min_gpa": null,
      "max_age": null,
      "citizenship": [],
      "majors": [],
      "identity_groups": [],
      "need_based": true,
      "nyc_only": true,
      "geo_scope": "city",
      "geo_areas": [
        "NYC"
      ],
      "enrolled_at": [
        "NYC public or charter high school"
      ],
      "prerequisites": []
    },
    "focus_tags": [
      "art",
      "architecture",
      "design",
      "portfolio",
      "weekend"
    ],
    "evidence": [
      {
        "field": "cost",
        "quote": "free, high-quality visual arts instruction"
      },
      {
        "field": "eligibility",
        "quote": "We welcome individuals that have little to no experience in the visual arts."
      },
      {
        "field": "dates",
        "quote": "Spring 2027 Semester January 30 – Week 1"
      },
      {
        "field": "dates",
        "quote": "April 10 - Week 10 (Last Session)"
      }
    ],
    "trust": {
      "badge": "web_verified",